,title,answer_count,follower_count,detail_text
0,女子劈开用几年的菜板已经全部发霉，其中会不会有黄曲霉素？对身体危害有多大？,74,433,688w
1,河南一水库水位下降现千佛石窟，很多佛像头部消失，这一石窟有多大考古价值？该如何对其进行保护？,59,289,534w
2,NASA「几乎所有重大新科学任务」拟被取消，将可能对美国及全球航天领域产生哪些影响？,113,391,435w
3,李在明正式开启总统任期，表示将拼经济保民生、寻求韩朝对话，李在明会给韩国政坛带来哪些变化？,320,967,367w
4,如何看待孔辉科技董事长郭川给中国汽车行业发的一封公开信呢？,71,122,301w
5,乌克兰称袭击了克里米亚大桥，桥下结构严重受损，为什么乌方想炸毁这座大桥？这座桥有多重要？,299,779,246w
6,巴黎世家平角短裤造型裙子 4500 一条，怎样看待这一设计？你觉得值吗？,86,109,192w
7,如何评价《机动战士高达GQuuuuuuX》第九集（沙仑的玫瑰）？,53,68,141w
8,你认为鸿蒙PC发展到什么地步才是不亚于win和Mac？,130,171,137w
9,张家界市一溶洞垃圾堆 7 层楼高，已打捞 2.7 吨，造成的污染还能恢复吗？排污者将承担哪些责任？,22,51,116w
10,广州一教师论文知网下载 95 万次 0 次引用，这个数据正常吗？论文从下载到被引用大概有哪些环节？,21,86,101w
11,如何评价常石磊的创作风格？怎么觉得怪怪的自成一派又很难欣赏？,19,27,83w
12,为什么成功人士的精力都非常旺盛？,328,1331,77w
13,单片机开发中，如何在断电前保存数据到dataflash？,43,220,72w
14,为什么冰箱全年无休24小时运作都不用休息，而空调连续开几个小时就要休息一会？,179,456,67w
15,2025年法国网球公开赛女单¼决赛，郑钦文0：2萨巴伦卡止步八强，怎么评价郑钦文这个赛季至今的低迷？,56,77,60w
16,女游客在三亚疑被蛇咬伤身亡，家属质疑两家医院抢救措施不当，到底是怎么回事？若属实医院需承担什么责任？,296,882,58w
17,《家有儿女》刘星的「捣蛋鬼」人设，放到现在会被贴上「熊孩子」标签吗？,36,81,58w
18,《碟中谍 8：最终清算》内地票房突破 2 亿，你如何评价这一票房成绩？你预测这部电影最终票房如何？,83,197,54w
19,现实中的叶问，真的能够打倒泰森级别的拳击手吗？,148,212,52w
