,title,answer_count,follower_count,detail_text
0,11 月 5 日我国第一艘电磁弹射「福建舰」入列服役，人民海军正式开启三航母时代，具有怎样的战略意义？,1241,2871,1192w
1,72 岁送垃圾老人痴迷数学，希望将一生研究手稿传承，如何客观评估老人的研究成果？如何看待他这份精神？,204,508,510w
2,R 星宣布《GTA 6》再次跳票至 2026 年 11月19日发售，他们延期的原因可能是什么？,60,114,163w
3,日产汽车将出售总部大楼，转为租用，今年4至9月亏损2219亿日元，此前曾官宣全球裁员2万人，如何解读？,45,138,123w
4,福建舰舰载机可满油满弹起飞，一分半弹射一架飞机，实战中这意味着什么？还有哪些信息值得关注？,18,46,120w
5,疑似郝蕾朋友圈锐评戛纳、威尼斯、东京三大电影节华语电影奖项，称「艺术良心很难拥有」，如何看待这一言论？,61,131,119w
6,马斯克万亿美元天价薪酬激励方案通过，超七成股东支持，特斯拉市值要在十年内达到8.5万亿美元，如何解读？,103,270,114w
7,审计署为啥叫署，不叫审计部？,34,120,109w
8,女子迷上奶皮子糖葫芦吃出「糖化脸」，怎么判断脸是不是被「糖化」了？戒糖之后能恢复吗？,75,549,99w
9,如何看待向太直播谈王家卫投资他的老板基本都亏钱，没有张叔平他是个屁这种犀利言论？,89,200,96w
10,电视剧《天道》到底好在哪里？,1000,4165,93w
11,我国首艘电磁弹射型航母福建舰 11 月 5 日官宣入列，什么是电磁弹射型航母？在世界上处于什么地位？,33,122,92w
12,世界知名华裔化学家林文斌全职加入西湖大学，这一举动将对大学带来哪些影响？,25,96,86w
13,悬疑剧《树影迷宫》中有哪些细思极恐的细节？,16,26,79w
14,《宝可梦传说Z-A》游戏，有哪些细思极恐的故事细节？,19,33,74w
15,陈梦参加体坛零距离采访谈到国乒内部竞争，表示「我在中间就像汉堡包一样，很难受」，对此你怎么看？,45,120,72w
16,油车开了九年多了，跑了快十万公里了，还很好开，朋友建议换电车，现在有必要换电车吗？,422,652,69w
17,如何评价全红婵退出 2025 年全运会单人项目比赛？,87,181,66w
18,为什么现在越来越多年轻人开始接受并主动寻求心理咨询？,25,30,60w
19,六耳猕猴明知道自己是假的，为什么还敢去见如来？,507,976,60w
